{
  "exportDate": "2026-09-13T14:32:00Z",
  "version": "1.0",
  "mode": "ai",
  "players": {
    "white": {
      "name": "Karl",
      "type": "human"
    },
    "black": {
      "name": "Stockfish (easy)",
      "type": "ai"
    }
  },
  "result": {
    "winner": "white",
    "reason": "checkmate"
  },
  "startingFen": "rnbqkbnr/pppppppp/8/8/8/8/PPPPPPPP/RNBQKBNR w KQkq - 0 1",
  "moves": [
    {
      "from": "e2",
      "to": "e4",
      "piece": "P",
      "color": "w",
      "promotion": null,
      "isCastle": null,
      "isEnPassant": false,
      "captured": null,
      "fen": "rnbqkbnr/pppppppp/8/8/4P3/8/PPPP1PPP/RNBQKBNR b KQkq e3 0 1"
    },
    {
      "from": "e7",
      "to": "e5",
      "piece": "P",
      "color": "b",
      "promotion": null,
      "isCastle": null,
      "isEnPassant": false,
      "captured": null,
      "fen": "rnbqkbnr/pppp1ppp/8/4p3/4P3/8/PPPP1PPP/RNBQKBNR w KQkq e6 0 2"
    },
    {
      "from": "f1",
      "to": "c4",
      "piece": "B",
      "color": "w",
      "promotion": null,
      "isCastle": null,
      "isEnPassant": false,
      "captured": null,
      "fen": "rnbqkbnr/pppp1ppp/8/4p3/2B1P3/8/PPPP1PPP/RNBQK1NR b KQkq - 1 2"
    },
    {
      "from": "b8",
      "to": "c6",
      "piece": "N",
      "color": "b",
      "promotion": null,
      "isCastle": null,
      "isEnPassant": false,
      "captured": null,
      "fen": "r1bqkbnr/pppp1ppp/2n5/4p3/2B1P3/8/PPPP1PPP/RNBQK1NR w KQkq - 2 3"
    },
    {
      "from": "d1",
      "to": "h5",
      "piece": "Q",
      "color": "w",
      "promotion": null,
      "isCastle": null,
      "isEnPassant": false,
      "captured": null,
      "fen": "r1bqkbnr/pppp1ppp/2n5/4p2Q/2B1P3/8/PPPP1PPP/RNB1K1NR b KQkq - 3 3"
    },
    {
      "from": "g8",
      "to": "f6",
      "piece": "N",
      "color": "b",
      "promotion": null,
      "isCastle": null,
      "isEnPassant": false,
      "captured": null,
      "fen": "r1bqkb1r/pppp1ppp/2n2n2/4p2Q/2B1P3/8/PPPP1PPP/RNB1K1NR w KQkq - 4 4"
    },
    {
      "from": "h5",
      "to": "f7",
      "piece": "Q",
      "color": "w",
      "promotion": null,
      "isCastle": null,
      "isEnPassant": false,
      "captured": "P",
      "fen": "r1bqkb1r/pppp1Qpp/2n2n2/4p3/2B1P3/8/PPPP1PPP/RNB1K1NR b KQkq - 0 4"
    }
  ]
}
